{
  "authority_pointer_ref": "runtime/total_field/ACTIVE_TOTAL_FIELD_AUTHORITY.json",
  "authority_pointer_sha256": "fa8f355bcafa63e8b97a798a5b157f8b5ef3fd2e2d73e043947bb5c99c7587d4",
  "contract_approved": true,
  "core_landing": "HOLD_PENDING_SEPARATE_AUTHORIZATION",
  "decision_sha256": "307cb24a24ce748b50081264ebdde0bf1ea1bf7e99a22b8204231a9d25736a37",
  "dynamic_context_record_id": "task-state:T-007:6fe6b04c524e81dd",
  "dynamic_context_record_sha256": "91b213811614e5c1509dad2b08c0f0d61012057bda1b6a3fbb14d67c2ac00e1b",
  "expires_at": "2026-10-04T21:25:12Z",
  "formal": true,
  "issued_at": "2026-10-04T20:58:04Z",
  "nonce": "nonce:sha256:8c5d7e17c43424bb7cd4030d61ec11fa3e4450924c74ba0c2753a8c9ffae5d9e",
  "package_binding_sha256": "00dccb5cb221fd5ddb3d44746efecc5cdc8116fcb464ff16f7520742233c422b",
  "packet_type": "TOTAL_FIELD_SUCCESSOR_REBIND_SEAL",
  "receipt_sha256": "6e350f4bcee85238a80ea910a1765fed6ae96f82f46abad72d56083907d285ae",
  "replay_guard": {
    "disposition": "CONSUMED",
    "domain": "T007_GLOBAL_SUCCESSOR_FORMAL",
    "single_use": true
  },
  "review_scope": "GLOBAL_CANONICAL_SUCCESSOR",
  "run_id": "T007_V23_GLOBAL_SUCCESSOR_20261002T124541Z",
  "schema_version": "W7TP-TOTAL-FIELD-SUCCESSOR-REBIND-SEAL/2.0",
  "seal_id": "seal:T007_V23_GLOBAL_SUCCESSOR_20261002T124541Z:6e350f4bcee85238",
  "seal_self_hash_algorithm": "SHA256_CANONICAL_JSON_EXCLUDING_SEAL_SHA256/1.0",
  "seal_sha256": "5535686c4de8271a1410e4b79ba034dabc2ed1ebf6843d424178c7255e8c6176",
  "seal_state": "FORMAL_SEAL",
  "source_manifest_sha256": "5a375de4e5b1ff0a233ec506ab4d7e14ddd9fcfcc5b240d298abc19f55066c3d"
}
